{
  "sessionId": "ses_01HZX9Q7QF0F5S6YCC3H3WZ6JH",
  "revision": 8,
  "generatedAt": "2026-04-05T14:28:12Z",
  "nodes": [
    {
      "id": "pg_home",
      "kind": "page",
      "label": "Home",
      "status": "ready"
    },
    {
      "id": "cmp_hero_2",
      "kind": "component",
      "label": "Hero",
      "status": "ready"
    },
    {
      "id": "ast_logo",
      "kind": "asset",
      "label": "Logo.svg",
      "status": "warning"
    }
  ],
  "edges": [
    {
      "from": "pg_home",
      "to": "cmp_hero_2",
      "relationship": "contains"
    },
    {
      "from": "cmp_hero_2",
      "to": "ast_logo",
      "relationship": "references"
    }
  ]
}
